{
  "$schema": "https://json-schema.org/draft-07/schema#",
  "title": "Public Invoice Extraction Schema",
  "type": "object",
  "required": [
    "invoice_number",
    "vendor",
    "bill_to",
    "line_items",
    "subtotal",
    "tax_rate",
    "tax_amount",
    "total_due",
    "payment_terms",
    "due_date"
  ],
  "properties": {
    "invoice_number": { "type": "string" },
    "vendor": { "type": "string" },
    "bill_to": { "type": "string" },
    "line_items": {
      "type": "array",
      "minItems": 1,
      "items": {
        "type": "object",
        "required": ["description", "quantity", "unit_price", "line_total"],
        "properties": {
          "description": { "type": "string" },
          "quantity": { "type": "number" },
          "unit_price": { "type": "number" },
          "line_total": { "type": "number" }
        }
      }
    },
    "subtotal": { "type": "number" },
    "tax_rate": { "type": "number" },
    "tax_amount": { "type": "number" },
    "total_due": { "type": "number" },
    "payment_terms": { "type": "string" },
    "due_date": { "type": "string", "pattern": "^\\d{4}-\\d{2}-\\d{2}$" }
  }
}
