{
  "invoice_number": "INV-2024-0047",
  "vendor": "Meridian Office Supplies",
  "bill_to": "Hargrove & Associates",
  "line_items": [
    {
      "description": "A4 Paper",
      "quantity": 10,
      "unit_price": 3500,
      "line_total": 35000
    },
    {
      "description": "Ballpoint Pens",
      "quantity": 5,
      "unit_price": 2200,
      "line_total": 11000
    },
    {
      "description": "Printer Cartridge",
      "quantity": 3,
      "unit_price": 8750,
      "line_total": 26250
    }
  ],
  "subtotal": 72250,
  "tax_rate": 0.075,
  "tax_amount": 5418.75,
  "total_due": 77669,
  "payment_terms": "Net 30",
  "due_date": "2024-03-15"
}
